[
  {
    "schema_version": "qratum.ui.session_list_item.v1",
    "session_id": "ses_0001",
    "source": "claude-code",
    "agent_model": "claude-sonnet-4-6",
    "repo": {
      "workspace_id": "ws_local",
      "repo_id": "repo_qratum",
      "git_remote": "git@github.com:edictum-ai/qratum.git",
      "git_branch": "main",
      "git_head_sha": "0000000000000000000000000000000000000000"
    },
    "review": {
      "verdict": "needs_attention",
      "main_finding": "2 verification command(s) ran in this session and none succeeded.",
      "warnings": [
        "successful verification command at any point in this session",
        "successful verification command after 2026-05-21T21:55:00Z",
        "test file change in the same session"
      ],
      "findings_count": 5,
      "evidence_count": 12
    },
    "metrics": {
      "duration_seconds": 3000,
      "tool_calls": 6,
      "files_changed": 2,
      "commands_run": 2,
      "tests_run": 2,
      "findings": 5,
      "warnings": 3
    },
    "artifacts": [
      {
        "schema_version": "qratum.ui.artifact_link.v1",
        "artifact_id": "ses_0001:redacted_session",
        "session_id": "ses_0001",
        "type": "redacted_session",
        "label": "Redacted session",
        "media_type": "application/json",
        "href": "sessions/ses_0001/redacted.json",
        "digest": "sha256:79f6401299bb46943e803ab0b3c9dfb355bc8345b090c2f9df10eb87b37532d8",
        "created_at": "2026-05-21T22:10:00Z"
      },
      {
        "schema_version": "qratum.ui.artifact_link.v1",
        "artifact_id": "ses_0001:evidence_bundle",
        "session_id": "ses_0001",
        "type": "evidence_bundle",
        "label": "Evidence bundle",
        "media_type": "application/json",
        "href": "sessions/ses_0001/evidence.json",
        "digest": "sha256:a5d97699a6eb7e32a4cea47d1eea101cee373c54224de3773f21dd9c4fc31056",
        "created_at": "2026-05-21T22:10:00Z"
      },
      {
        "schema_version": "qratum.ui.artifact_link.v1",
        "artifact_id": "ses_0001:review_card",
        "session_id": "ses_0001",
        "type": "review_card",
        "label": "Review card",
        "media_type": "application/json",
        "href": "sessions/ses_0001/review.json",
        "digest": "sha256:36bc93d61c5f51fa8a7cac01b932727fab81fc5a124485d93fe2dd8cbe5c53ba",
        "created_at": "2026-05-21T22:10:00Z"
      },
      {
        "schema_version": "qratum.ui.artifact_link.v1",
        "artifact_id": "ses_0001:html_report",
        "session_id": "ses_0001",
        "type": "html_report",
        "label": "HTML report",
        "media_type": "text/html",
        "href": "sessions/ses_0001/report.html",
        "digest": "sha256:7eebcba0121ff4a405d0b341c4236c9e87e7fb71da1212d242f349e0ea454e05",
        "created_at": "2026-05-21T22:10:00Z"
      },
      {
        "schema_version": "qratum.ui.artifact_link.v1",
        "artifact_id": "ses_0001:adp_strict_export",
        "session_id": "ses_0001",
        "type": "adp_strict_export",
        "label": "ADP strict export",
        "media_type": "application/jsonl",
        "href": "sessions/ses_0001/session.adp.jsonl",
        "digest": "sha256:557d1570a922936d2719bd74e6bcb031492101b3895473747842236e2bebddf4",
        "created_at": "2026-05-21T22:10:00Z"
      }
    ]
  }
]
